{
  "$schema": "https://json-schema.org/draft/2020-12/schema",
  "$id": "https://schemas.wur.nl/betula/annotation/0.3.0/schema.json",
  "title": "Annotation",
  "description": "A GFF3-derived sequence feature (gene model) node. Shared verbatim between picea (SequenceInterval) and react-bio-viz (SequenceInterval). seqid/start/end/strand stay flat rather than nesting under core/Location, to match the real current wire shape exactly.",
  "type": "object",
  "properties": {
    "type": {
      "const": "annotation",
      "description": "Wire-format object-kind discriminator (see betula's versioning policy). Optional. Distinct from 'interval_type': 'type' says this is a betula Annotation object, 'interval_type' says which GFF3 feature kind it is."
    },
    "ID": { "$ref": "https://schemas.wur.nl/betula/core/identifier/0.3.0/schema.json" },
    "seqid": {
      "$ref": "https://schemas.wur.nl/betula/core/identifier/0.3.0/schema.json",
      "description": "GFF3 column 1: the reference sequence this feature is on."
    },
    "source": {
      "type": "string",
      "description": "GFF3 column 2."
    },
    "interval_type": {
      "type": "string",
      "minLength": 1,
      "description": "GFF3 column 3 (feature type), e.g. 'gene', 'mRNA', 'exon', 'CDS'. Doubles as this schema's wire-format type discriminator."
    },
    "start": {
      "type": "integer",
      "minimum": 1,
      "description": "GFF3 column 4: 1-based inclusive start."
    },
    "end": {
      "type": "integer",
      "minimum": 1,
      "description": "GFF3 column 5: 1-based inclusive end."
    },
    "score": {
      "description": "GFF3 column 6. '.' is the GFF3 convention for 'no score'.",
      "oneOf": [{ "type": "number" }, { "const": "." }]
    },
    "strand": {
      "type": "string",
      "enum": ["+", "-", "."],
      "description": "GFF3 column 7."
    },
    "phase": {
      "description": "GFF3 column 8 (CDS reading-frame phase). '.' is the GFF3 convention for 'not applicable'.",
      "oneOf": [{ "enum": [0, 1, 2] }, { "const": "." }]
    },
    "attributes": { "$ref": "https://schemas.wur.nl/betula/core/metadata/0.3.0/schema.json" },
    "children": {
      "type": "array",
      "items": { "$ref": "#" },
      "description": "Nested features, e.g. mRNA under gene, exon/CDS under mRNA."
    }
  },
  "required": ["ID", "seqid", "source", "interval_type", "start", "end", "score", "strand", "phase", "attributes", "children"],
  "additionalProperties": false
}
